{
  "schema_version": "1.0",
  "scenario_id": "PCAP-081",
  "status": "PASS",
  "fields": {
    "protocol": {
      "status": "PASS",
      "expected": "SMTP",
      "observed": "SMTP"
    },
    "starttls_status": {
      "status": "PASS",
      "expected": "IMPLICIT_TLS",
      "observed": "IMPLICIT_TLS"
    },
    "tls_presence": {
      "status": "PASS",
      "expected": "implicit-TLS",
      "observed": "implicit-TLS"
    },
    "tls.fatal_alert": {
      "status": "NOT_APPLICABLE",
      "expected": false,
      "observed": false
    },
    "tls.version": {
      "status": "PASS",
      "expected": "TLS 1.0",
      "observed": "TLS 1.0"
    },
    "tls.cipher_strength": {
      "status": "PASS",
      "expected": "WEAK",
      "observed": "WEAK"
    },
    "tls.cipher_name": {
      "status": "PASS",
      "expected": "TLS_DHE_RSA_WITH_AES_128_CBC_SHA",
      "observed": "TLS_DHE_RSA_WITH_AES_128_CBC_SHA"
    },
    "tls.forward_secrecy": {
      "status": "NOT_APPLICABLE",
      "expected": null,
      "observed": true
    },
    "certificate.observable": {
      "status": "PASS",
      "expected": "VISIBLE",
      "observed": "VISIBLE"
    },
    "certificate.signature_algorithm": {
      "status": "PASS",
      "expected": "RSA-PSS",
      "observed": "PSS"
    },
    "certificate.validity": {
      "status": "PASS",
      "expected": "expired",
      "observed": "expired"
    },
    "certificate.hostname_match": {
      "status": "PASS",
      "expected": "matched",
      "observed": "matched"
    },
    "certificate.trust_status": {
      "status": "PASS",
      "expected": "EXPIRED",
      "observed": "EXPIRED"
    }
  },
  "mismatches": [],
  "unknowns": [],
  "evaluated_stream": 0
}