{
  "schema_version": "1.0",
  "scenario_id": "PCAP-124",
  "status": "INCONCLUSIVE",
  "fields": {
    "protocol": {
      "status": "PASS",
      "expected": "POP3",
      "observed": "POP3"
    },
    "starttls_status": {
      "status": "PASS",
      "expected": "UPGRADED",
      "observed": "UPGRADED"
    },
    "tls_presence": {
      "status": "PASS",
      "expected": "STARTTLS-upgraded",
      "observed": "STARTTLS-upgraded"
    },
    "tls.fatal_alert": {
      "status": "NOT_APPLICABLE",
      "expected": false,
      "observed": false
    },
    "tls.version": {
      "status": "PASS",
      "expected": "TLS 1.3",
      "observed": "TLS 1.3"
    },
    "tls.cipher_strength": {
      "status": "PASS",
      "expected": "HIGH",
      "observed": "HIGH"
    },
    "tls.cipher_name": {
      "status": "PASS",
      "expected": "TLS_AES_128_GCM_SHA256",
      "observed": "TLS_AES_128_GCM_SHA256"
    },
    "tls.forward_secrecy": {
      "status": "PASS",
      "expected": true,
      "observed": true
    },
    "certificate.observable": {
      "status": "PASS",
      "expected": "ENCRYPTED",
      "observed": "UNOBSERVABLE"
    },
    "certificate.signature_algorithm": {
      "status": "UNOBSERVABLE",
      "expected": "ECDSA",
      "observed": null
    },
    "certificate.validity": {
      "status": "UNOBSERVABLE",
      "expected": "valid",
      "observed": null
    },
    "certificate.hostname_match": {
      "status": "UNOBSERVABLE",
      "expected": "matched",
      "observed": null
    },
    "certificate.trust_status": {
      "status": "UNOBSERVABLE",
      "expected": "TRUSTED_CHAIN",
      "observed": null
    }
  },
  "mismatches": [],
  "unknowns": [
    "certificate.signature_algorithm",
    "certificate.validity",
    "certificate.hostname_match",
    "certificate.trust_status"
  ],
  "evaluated_stream": 0
}