{
  "schema_version": "1.0",
  "scenario_id": "PCAP-107",
  "status": "PASS",
  "fields": {
    "protocol": {
      "status": "PASS",
      "expected": "SMTP",
      "observed": "SMTP"
    },
    "starttls_status": {
      "status": "PASS",
      "expected": "IMPLICIT_TLS",
      "observed": "IMPLICIT_TLS"
    },
    "tls_presence": {
      "status": "PASS",
      "expected": "implicit-TLS",
      "observed": "implicit-TLS"
    },
    "tls.fatal_alert": {
      "status": "NOT_APPLICABLE",
      "expected": false,
      "observed": false
    },
    "tls.version": {
      "status": "PASS",
      "expected": "TLS 1.3",
      "observed": "TLS 1.3"
    },
    "tls.cipher_strength": {
      "status": "PASS",
      "expected": "HIGH",
      "observed": "HIGH"
    },
    "tls.cipher_name": {
      "status": "NOT_APPLICABLE",
      "expected": null,
      "observed": "TLS_AES_256_GCM_SHA384"
    },
    "tls.forward_secrecy": {
      "status": "PASS",
      "expected": true,
      "observed": true
    },
    "certificate.observable": {
      "status": "PASS",
      "expected": "NOT_PRESENT",
      "observed": "NOT_PRESENT"
    },
    "certificate.signature_algorithm": {
      "status": "NOT_APPLICABLE",
      "expected": null,
      "observed": null
    },
    "certificate.validity": {
      "status": "NOT_APPLICABLE",
      "expected": null,
      "observed": null
    },
    "certificate.hostname_match": {
      "status": "NOT_APPLICABLE",
      "expected": null,
      "observed": null
    },
    "certificate.trust_status": {
      "status": "NOT_APPLICABLE",
      "expected": null,
      "observed": null
    }
  },
  "mismatches": [],
  "unknowns": [],
  "evaluated_stream": 0
}