{
  "schema_version": "1.0",
  "scenario_id": "PCAP-097",
  "status": "PASS",
  "fields": {
    "protocol": {
      "status": "PASS",
      "expected": "SMTP",
      "observed": "SMTP"
    },
    "starttls_status": {
      "status": "PASS",
      "expected": "IMPLICIT_TLS",
      "observed": "IMPLICIT_TLS"
    },
    "tls_presence": {
      "status": "PASS",
      "expected": "implicit-TLS",
      "observed": "implicit-TLS"
    },
    "tls.fatal_alert": {
      "status": "NOT_APPLICABLE",
      "expected": false,
      "observed": false
    },
    "tls.version": {
      "status": "PASS",
      "expected": "TLS 1.1",
      "observed": "TLS 1.1"
    },
    "tls.cipher_strength": {
      "status": "PASS",
      "expected": "BROKEN",
      "observed": "BROKEN"
    },
    "tls.cipher_name": {
      "status": "PASS",
      "expected": "TLS_ECDHE_ECDSA_WITH_NULL_SHA",
      "observed": "TLS_ECDHE_ECDSA_WITH_NULL_SHA"
    },
    "tls.forward_secrecy": {
      "status": "NOT_APPLICABLE",
      "expected": null,
      "observed": true
    },
    "certificate.observable": {
      "status": "PASS",
      "expected": "VISIBLE",
      "observed": "VISIBLE"
    },
    "certificate.signature_algorithm": {
      "status": "PASS",
      "expected": "RSA-PKCS1v15",
      "observed": "PKCS1v15"
    },
    "certificate.validity": {
      "status": "PASS",
      "expected": "valid",
      "observed": "valid"
    },
    "certificate.hostname_match": {
      "status": "PASS",
      "expected": "matched",
      "observed": "matched"
    },
    "certificate.trust_status": {
      "status": "PASS",
      "expected": "INCOMPLETE_CHAIN_MISSING_INTERMEDIATE",
      "observed": "INCOMPLETE_CHAIN_MISSING_INTERMEDIATE"
    }
  },
  "mismatches": [],
  "unknowns": [],
  "evaluated_stream": 0
}